{"analysis_scope_digest":"7b47e00a7c7544149d5957ff918c13b3efb115665cac71774408157ecd00d8d1","artifact_kind":"REVIEW_SLICE_SET","canonicalization_profile":"veritrail-json-c14n/1","derivation_profile_digest":"e8bbe54140ff2a082b69d6b6967d8630a423abd135ac6e7be0badc1fe053125b","fact_set_digest":"a1caf8e57c7362649cdbe4c18a857e470bf930f4c6e07b47c95b0cf4af53e45a","policy_digest":"ba5d50b166e56a5d8ee3fd8fd56841e8008dd43196c1547840810eb3e6209c4a","relation_set_digest":"62586ad1209dec7e76dbb3af006a7e4099831cbfd149dc3114bad27d463f7d1a","schema_version":"0.1","slice_policy_digest":"6633300a034ccfa2fe4d60a55215cf3c792479a8cdbf23404e9024b50fb6f4a4","slice_set_digest":"da97e3a1552d727225b4354fd96cd87bd0d313ab54209a1a5feebfa7d425c687","slices":[{"coverage_status":"COMPLETE","frontier":[],"included_fact_ids":["7a00cb5656f706ad97b236ed0cf239dbac84400d1845d557fb4444f7c12069f8","ffbec0037c18189f6d6af2e28ababcbed60b61a299ce58d1e0ca3f1cbcf15bf7"],"included_relation_ids":["243fa6dba97154a6d6c7d712405640fb6f573573c359079b44cfb44ff7136089","67665e4c89ffb97521aba6ba221ba61d098258f2a899e38f03361d7324d328ff"],"slice_id":"0deb8cdb850ef5edb1c7ae131aa852ca87ff7a1cf475b8649946cd07e450fd2e","slice_spec":{"allowed_relations":[{"direction":"OUTBOUND","relation_kind":"LEXICAL_CONTAINS"},{"direction":"OUTBOUND","relation_kind":"IMPORT_TARGET_LITERAL"}],"analysis_scope_digest":"7b47e00a7c7544149d5957ff918c13b3efb115665cac71774408157ecd00d8d1","anchor_fact_id":"ffbec0037c18189f6d6af2e28ababcbed60b61a299ce58d1e0ca3f1cbcf15bf7","derivation_profile_digest":"e8bbe54140ff2a082b69d6b6967d8630a423abd135ac6e7be0badc1fe053125b","fact_set_digest":"a1caf8e57c7362649cdbe4c18a857e470bf930f4c6e07b47c95b0cf4af53e45a","max_depth":1,"max_files":1,"max_relations":2,"max_symbols":2,"relation_set_digest":"62586ad1209dec7e76dbb3af006a7e4099831cbfd149dc3114bad27d463f7d1a","slice_policy_digest":"6633300a034ccfa2fe4d60a55215cf3c792479a8cdbf23404e9024b50fb6f4a4","slice_spec_digest":"093a23cdafab78e8c1240c756822a872e8f0010bfe05344ba7123455cfd427f1","source_snapshot_digest":"3acb02f99805fd684ff68a1e0d2a2e24a22d75232564a1f52646c89e4398f747"}}],"source_snapshot_digest":"3acb02f99805fd684ff68a1e0d2a2e24a22d75232564a1f52646c89e4398f747"}
